{
  "schema_version": 1,
  "scope": "isolated_candidate_only",
  "policies": {
    "advances_live_acceptance": false,
    "runtime_evidence_added": false,
    "network": false,
    "docker": false,
    "subprocess": false,
    "writes": false,
    "lifecycle": false,
    "downloads": false,
    "credentials": false,
    "warehouse_sample_bundle_used": false
  },
  "baseline_locks": [
    {"path": "deploy/docker/thor-local/qualification/acceptance_inventory.json", "sha256": "79001985f9cc9d0dbb64adea2a014aaedacd0b0411d8becb5b311c8697a563a5"},
    {"path": "deploy/docker/thor-local/parity/official-capabilities.json", "sha256": "53670839f97b50238580741e71ae54a28ef50a7259ee1a847ebc66fc7a26c47d"},
    {"path": "deploy/docker/thor-local/parity/capability-oracles.json", "sha256": "573d5a6804f0a2ac502a6f2eede0a90331a5c330b395c0e2c1f7eb19282f1ae2"},
    {"path": "deploy/docker/thor-local/qualification/executor-cases/inventory.json", "sha256": "3bafdeebb363503a416f3dd22d3277c11dfabbe55724b77a45fc7b534c93ed35"},
    {"path": "deploy/docker/thor-local/qualification/source-contract-cases/inventory.json", "sha256": "e691a02128e60d3817474c9d19e0cda69da8cb238c86496fe2df1f658b25d079"},
    {"path": "deploy/docker/thor-local/qualification/planning-requirement-executors-wave3/inventory.json", "sha256": "386047abc54476062635913b9a3fc2ccfb73e3263f7d93c6fac8c6769b567232"},
    {"path": "deploy/docker/thor-local/qualification/planning-requirement-executors-wave4/inventory.json", "sha256": "f171453f37d998eb26f56e9ed74d09bad9a00ef1ac4e1c7122e790219271d5a4"},
    {"path": "deploy/docker/thor-local/qualification/planning-requirement-executors-wave5/inventory.json", "sha256": "d10a511c482d80e6167b8ac3a7ed97070d758ea709a4635f3a97526c803ef942"},
    {"path": "deploy/docker/thor-local/qualification/planning-requirement-executors-wave6/inventory.json", "sha256": "bdcaf973fddf291fc35a0d27ae7a7a9414e5d62367c9100fef6d80f39d86fec7"},
    {"path": "deploy/docker/thor-local/qualification/planning-requirement-executors-wave7/inventory.json", "sha256": "d670829d85239bfb924737d32565eb3b87a0378df2520d225df72a75617122d9"}
  ],
  "cases": [
    {
      "case_id": "wave8-source-case.lvs-empty-caption-limitation",
      "planning_requirement_id": "systems-lvs-empty-caption",
      "capability_id": "behavior.lvs.live-caption-empty-window",
      "planning_payload_sha256": "ba2276f69be440b6da2319bf8cc843b2550648e6436a78d7289e79a7a05c6cbf",
      "capability_sha256": "d85518241f7838e07fe27bce83db2b90b91abc6670c1dd93191c897064bb6605",
      "contract_sha256": "1ac137907f009d29a62ae589e101b86ff4ef39a3859a0ed8767b74a0ba254a08",
      "oracle_sha256": "f042202e0cbb0e66563a1ed0e16d09357c9c6e9c7f24d5cb07db83fea9611e87",
      "evidence_class": "static_negative_contract_preserved",
      "source_locks": [
        {"path": "deploy/docker/thor-local/parity/candidates/wave3/systems/candidate.json", "sha256": "0abc81c383a9db122d2ad74c4dbb6c85cc00caf032abd94c4e7d632ce97ff539"},
        {"path": "deploy/docker/thor-local/parity/candidates/wave3/systems/evidence/2026-07-31-systems-extraction.md", "sha256": "142ef0130b322828a888c32e5459d3d89c3a2c0620e061027f2a891049c0a982"}
      ],
      "assertions": [
        {"assertion_id": "exact-empty-window-negative-contract", "sources": ["deploy/docker/thor-local/parity/candidates/wave3/systems/candidate.json"], "expected": ["\"id\":\"behavior.lvs.live-caption-empty-window\"", "\"contract\":{\"empty_window\":\"no-captions\",\"known_issue\":true}", "\"gap\":\"Known issue has no regression fixture.\""]},
        {"assertion_id": "conservative-release-note-mapping", "sources": ["deploy/docker/thor-local/parity/candidates/wave3/systems/evidence/2026-07-31-systems-extraction.md"], "expected": ["Known failure/recovery semantics retained here include LVS", "empty caption windows", "It is intentionally conservative"]}
      ],
      "runtime_evidence": []
    },
    {
      "case_id": "wave8-source-case.lvs-shared-prompt-limitation",
      "planning_requirement_id": "systems-lvs-shared-prompt",
      "capability_id": "behavior.lvs.shared-caption-prompt",
      "planning_payload_sha256": "a2b1537024f64644a6b2d32df1b6671aad115f92a9cf48b2d857ca6596a49661",
      "capability_sha256": "d09989ee585f74595c2a7a6bb2fea37796a65d66e2444b1d01e6bd1597fdee51",
      "contract_sha256": "1c500c7705c6a4f5ab82b6001e1906b48931e5a306e198038bd37f38ad90444a",
      "oracle_sha256": "0ab65edd7654823de57a6d34fe09832acd8e19bd1b159ac6e59f61336252b53b",
      "evidence_class": "static_negative_contract_preserved",
      "source_locks": [
        {"path": "deploy/docker/thor-local/parity/candidates/wave3/systems/candidate.json", "sha256": "0abc81c383a9db122d2ad74c4dbb6c85cc00caf032abd94c4e7d632ce97ff539"},
        {"path": "deploy/docker/thor-local/parity/candidates/wave3/systems/evidence/2026-07-31-systems-extraction.md", "sha256": "142ef0130b322828a888c32e5459d3d89c3a2c0620e061027f2a891049c0a982"}
      ],
      "assertions": [
        {"assertion_id": "exact-shared-prompt-negative-contract", "sources": ["deploy/docker/thor-local/parity/candidates/wave3/systems/candidate.json"], "expected": ["\"id\":\"behavior.lvs.shared-caption-prompt\"", "\"contract\":{\"shared_backend\":\"last-writer-wins\",\"cross_agent_visibility\":false,\"known_issue\":true}", "\"gap\":\"Shared prompt collision is not tested.\""]},
        {"assertion_id": "conservative-release-note-mapping", "sources": ["deploy/docker/thor-local/parity/candidates/wave3/systems/evidence/2026-07-31-systems-extraction.md"], "expected": ["shared-prompt last-writer behavior", "Known failure/recovery semantics retained here", "It is intentionally conservative"]}
      ],
      "runtime_evidence": []
    },
    {
      "case_id": "wave8-source-case.lvs-spurious-index-limitation",
      "planning_requirement_id": "systems-lvs-spurious-index",
      "capability_id": "behavior.lvs.caption-spurious-index",
      "planning_payload_sha256": "0ffa2f9f990b37f9a350f7f19c26f0383f4e3a6b460b0cba478910e53128686e",
      "capability_sha256": "eb5a25d858fa3af76362ccc8950b93af7c3c02d561910ed63c6b0fcf7d765b36",
      "contract_sha256": "d89d2c15a53e45d1f703f7e9e6cda87f8f09ada2982d589d1abbfab49cfe8b24",
      "oracle_sha256": "ce07a853675db9fe44117a697f184ddaee2f56c79fca8dbf0541c76e229c7e6d",
      "evidence_class": "static_negative_contract_preserved",
      "source_locks": [
        {"path": "deploy/docker/thor-local/parity/candidates/wave3/systems/candidate.json", "sha256": "0abc81c383a9db122d2ad74c4dbb6c85cc00caf032abd94c4e7d632ce97ff539"},
        {"path": "deploy/docker/thor-local/parity/candidates/wave3/systems/evidence/2026-07-31-systems-extraction.md", "sha256": "142ef0130b322828a888c32e5459d3d89c3a2c0620e061027f2a891049c0a982"}
      ],
      "assertions": [
        {"assertion_id": "exact-spurious-index-negative-contract", "sources": ["deploy/docker/thor-local/parity/candidates/wave3/systems/candidate.json"], "expected": ["\"id\":\"behavior.lvs.caption-spurious-index\"", "\"trigger_values\":[\"yes\",\"true\"]", "\"artifact\":\"mdx-vlm-incidents-1970-01-01\"", "\"known_issue\":true", "\"gap\":\"Known artifact has no regression fixture.\""]},
        {"assertion_id": "conservative-release-note-mapping", "sources": ["deploy/docker/thor-local/parity/candidates/wave3/systems/evidence/2026-07-31-systems-extraction.md"], "expected": ["epoch-dated", "spurious incident index", "Known failure/recovery semantics retained here"]}
      ],
      "runtime_evidence": []
    },
    {
      "case_id": "wave8-source-case.cr2-redeployment-limitation",
      "planning_requirement_id": "systems-cr2-recovery",
      "capability_id": "behavior.base.cr2-nim-recovery",
      "planning_payload_sha256": "8fc26e615f47f65000f3ffccaae58633318ae9b035db3ea3744540e7debe365c",
      "capability_sha256": "3388f861e909e090c57881102f0b2c7b82f7388fe546ffa8f93aa4d2980a99ac",
      "contract_sha256": "613e81b28cf3ffd771884ce84a676970f52b0a2b956085136c5d780bbcc4c45a",
      "oracle_sha256": "76aaae726dede06673709c1a84f8ace632416de0b9fdd494209b198d10c5964c",
      "evidence_class": "static_negative_contract_preserved",
      "source_locks": [
        {"path": "deploy/docker/thor-local/parity/candidates/wave3/systems/candidate.json", "sha256": "0abc81c383a9db122d2ad74c4dbb6c85cc00caf032abd94c4e7d632ce97ff539"},
        {"path": "deploy/docker/thor-local/parity/candidates/wave3/systems/evidence/2026-07-31-systems-extraction.md", "sha256": "142ef0130b322828a888c32e5459d3d89c3a2c0620e061027f2a891049c0a982"},
        {"path": "skills/vss-deploy-profile/references/troubleshooting.md", "sha256": "075e8179ecde590039c3214c054239215d27d19906887938c4bcd7d7c86041e2"}
      ],
      "assertions": [
        {"assertion_id": "exact-cr2-negative-contract", "sources": ["deploy/docker/thor-local/parity/candidates/wave3/systems/candidate.json"], "expected": ["\"id\":\"behavior.base.cr2-nim-recovery\"", "\"contract\":{\"failure\":\"CR2-NIM-crash\",\"recovery\":\"redeploy\",\"known_issue\":true}", "\"gap\":\"Safe recovery has not been fault-injected.\""]},
        {"assertion_id": "local-guidance-preserves-redeploy-boundary", "sources": ["deploy/docker/thor-local/parity/candidates/wave3/systems/evidence/2026-07-31-systems-extraction.md", "skills/vss-deploy-profile/references/troubleshooting.md"], "expected": ["CR2 NIM redeployment recovery", "Known CR2/NIM restart limitation", "Redeploy the full affected VSS stack"]}
      ],
      "runtime_evidence": []
    },
    {
      "case_id": "wave8-source-case.search-known-limitations",
      "planning_requirement_id": "systems-search-known-issues",
      "capability_id": "behavior.search.retention-indexing-quality",
      "planning_payload_sha256": "199ba2bd7a639fc02a90f1830c9ed19c67393c308335be4eb7a461535d930b15",
      "capability_sha256": "c43de28c8c3862df8e6a70c4d45a3620370416dfe3e63467fc3979e43ca9bc7b",
      "contract_sha256": "8aaea08275b46eabc2da1628cdf32f2dbc887cccce1f1478b8c3f07c17e7277e",